{
    "Name": "NIFTY 50 Total Returns Index",
    "StartYear": 1999,
    "StartMonth": 6,
    "Currency": "INR",
    "NetAssetValueArray":
    [
        1256.38,
        1386.99,
        1496.66,
        1497.9,
        1405.03,
        1459.09,
        1562.92,
        1639.66,
        1755.45,
        1623.5,
        1502.41,
        1474.94,
        1573.55,
        1426.26,
        1492.45,
        1362.52,
        1256.62,
        1358.92,
        1354.05,
        1470.01,
        1448.26,
        1230.49,
        1207.72,
        1256.58,
        1193.8,
        1159.68,
        1141.48,
        991.77,
        1055.47,
        1159.08,
        1150.28,
        1168.1,
        1242.55,
        1228.95,
        1181.82,
        1122.86,
        1155.86,
        1054.4,
        1115.02,
        1063.92,
        1053.44,
        1162.91,
        1211.66,
        1154.67,
        1178.72,
        1084.64,
        1038,
        1122.32,
        1272.21,
        1337.86,
        1538.08,
        1610.21,
        1770.08,
        1837.98,
        2139.93,
        2062.42,
        2052.4,
        2020.25,
        2048.22,
        1698.16,
        1727.93,
        1878.62,
        1882.09,
        2020.62,
        2069.39,
        2268.99,
        2418.88,
        2393.76,
        2447.94,
        2369.69,
        2214.96,
        2433.73,
        2599.93,
        2711.24,
        2801.99,
        3066.15,
        2795.89,
        3127.8,
        3353.37,
        3549.92,
        3639.43,
        4028.82,
        4213.88,
        3642.31,
        3721.71,
        3745.46,
        4073.55,
        4288.97,
        4476.5,
        4729.13,
        4758.45,
        4899.39,
        4504.73,
        4605.89,
        4934.46,
        5185.95,
        5223.82,
        5483.25,
        5411.29,
        6094.11,
        7163.3,
        6997.6,
        7461.48,
        6245.45,
        6356.92,
        5762.88,
        6289.07,
        5937.81,
        4929.98,
        5297.47,
        5337.28,
        4807.2,
        3539.57,
        3379.53,
        3635.87,
        3538.57,
        3403.33,
        3720.51,
        4278.54,
        5480.11,
        5296.58,
        5737.09,
        5774.96,
        6302.19,
        5846.03,
        6245.49,
        6456.97,
        6061.68,
        6114.27,
        6521.55,
        6559.98,
        6330.54,
        6636.89,
        6712.14,
        6762.76,
        7554.94,
        7546.4,
        7353.36,
        7698.29,
        6910.76,
        6696.09,
        7327.83,
        7224.51,
        6997.07,
        7133.6,
        6934.57,
        6334.48,
        6265.26,
        6755.07,
        6128.97,
        5865.49,
        6600.95,
        6838.32,
        6728.46,
        6668.4,
        6275.4,
        6752.88,
        6700.96,
        6747.3,
        7321.57,
        7217.67,
        7556.73,
        7591.99,
        7759.87,
        7322.68,
        7315.35,
        7634.29,
        7734.03,
        7563.28,
        7449.52,
        7103.56,
        7454.82,
        8194.06,
        8035.27,
        8204.85,
        7930.34,
        8178.01,
        8739.91,
        8730.05,
        9437.81,
        9966.14,
        10140.34,
        10456.85,
        10475.04,
        10952.14,
        11303.65,
        10904.18,
        11598.64,
        11723.28,
        11201.99,
        10794.27,
        11135.85,
        11085.87,
        11328.56,
        10588.8,
        10566.29,
        10732.25,
        10560.84,
        10575.63,
        10068.86,
        9304.26,
        10325.5,
        10474.15,
        10908.07,
        11121.39,
        11614.8,
        11826.19,
        11598.22,
        11628.32,
        11092.59,
        11040.41,
        11548.15,
        11990.44,
        12406.69,
        12582.88,
        13018.69,
        12932.33,
        13724.19,
        13521.03,
        13351.99,
        14108.55,
        13966.58,
        14381.92,
        15065.82,
        14358.71,
        13865.57,
        14723.32,
        14750.26,
        14753.91,
        15672.47,
        16143.51,
        15114.08,
        14377.38,
        15059.37,
        15048.98,
        15012.34,
        14979.39,
        16146.11,
        16318.66,
        16583.46,
        16433.85,
        15539.43,
        15440.47,
        16072.5,
        16667.29,
        16917.89,
        17077.06,
        16790.45,
        15726.92,
        12105.66,
        13884.18,
        13503.45,
        14527.18,
        15645.34,
        16110.07,
        15916.72,
        16504.16,
        18392.54
    ]
}
