{
    "Name": "Gold Price Per Troy Oz",
    "StartYear": 1979,
    "StartMonth": 1,
    "Currency": "INR",
    "NetAssetValueArray":
    [
        1840.8,
        2011.7,
        1940.2,
        2013.1,
        2253.4,
        2190.6,
        2354.1,
        2527.7,
        3190.3,
        3142.6,
        3310.3,
        4189.6,
        5329.6,
        5138.1,
        4155.4,
        4155.2,
        4152.3,
        5150.4,
        4813.2,
        4903.6,
        5211.3,
        4911.2,
        4871.9,
        4620.3,
        4123.2,
        4082.9,
        4240.5,
        3998.5,
        4046.5,
        3703.8,
        3655.1,
        3820.1,
        3870.4,
        3876.4,
        3815.0,
        3625.1,
        3546.0,
        3373.9,
        2987.6,
        3322.1,
        3072.3,
        2971.9,
        3265.4,
        3933.3,
        3824.8,
        4108.4,
        4127.6,
        4320.0,
        5003.5,
        4197.0,
        4104.3,
        4286.4,
        4391.8,
        4183.6,
        4291.0,
        4219.7,
        4123.3,
        3923.5,
        4218.6,
        3995.0,
        4002.4,
        4220.1,
        4169.1,
        4094.2,
        4218.3,
        4178.2,
        3919.9,
        4007.9,
        4140.0,
        4017.0,
        4016.0,
        3825.9,
        3834.8,
        3783.1,
        4001.6,
        3994.6,
        3857.0,
        3874.7,
        3901.3,
        3974.0,
        3826.2,
        3899.9,
        3861.2,
        3920.6,
        4329.0,
        4172.4,
        4172.5,
        4206.1,
        4364.7,
        4276.4,
        4468.9,
        4778.8,
        5376.9,
        5187.4,
        5069.3,
        5061.0,
        5264.7,
        5202.4,
        5419.5,
        5734.5,
        5758.3,
        5727.8,
        5938.2,
        5870.5,
        5954.3,
        6078.5,
        6230.4,
        6116.9,
        6056.5,
        5501.9,
        6171.1,
        5900.7,
        6119.1,
        6143.3,
        6290.8,
        6120.7,
        5773.7,
        6296.2,
        6256.7,
        6123.1,
        5970.3,
        5884.4,
        5942.8,
        5922.9,
        5869.4,
        6142.9,
        6011.3,
        5962.5,
        6115.9,
        6309.7,
        6881.8,
        6624.8,
        7041.0,
        6957.4,
        6334.4,
        6379.3,
        6295.5,
        6140.5,
        6457.2,
        6783.8,
        7333.1,
        6895.0,
        6999.6,
        6948.9,
        6810.6,
        6917.0,
        6942.2,
        7226.6,
        7527.3,
        7785.6,
        9348.0,
        8953.7,
        9120.5,
        9241.4,
        9466.7,
        9080.6,
        9182.9,
        9210.3,
        9913.3,
        9615.7,
        9669.2,
        9838.5,
        10174.5,
        9700.0,
        9903.8,
        9632.5,
        9425.6,
        9639.3,
        9642.4,
        9885.6,
        10539.9,
        11114.5,
        11780.3,
        11869.9,
        12585.5,
        11702.3,
        11159.0,
        11602.7,
        11630.4,
        12252.6,
        11853.7,
        11967.3,
        12209.6,
        11808.3,
        12159.4,
        12085.7,
        12046.5,
        12100.5,
        12383.2,
        12044.2,
        12027.8,
        12022.1,
        11762.5,
        11828.8,
        12314.7,
        12250.8,
        12076.6,
        12153.4,
        12042.9,
        12179.8,
        13027.2,
        13086.6,
        13532.3,
        13608.9,
        14776.2,
        13892.5,
        13515.5,
        13597.7,
        13681.0,
        13457.9,
        13697.4,
        13784.7,
        13511.3,
        13510.2,
        13262.8,
        13228.4,
        12394.8,
        12866.6,
        12489.9,
        12162.1,
        12363.8,
        11976.9,
        11649.1,
        11820.0,
        12012.1,
        11324.1,
        11452.0,
        11378.7,
        11834.3,
        11702.7,
        11884.2,
        12339.5,
        12235.8,
        12555.7,
        12287.7,
        11625.0,
        12460.1,
        12381.8,
        12548.3,
        12230.4,
        12130.9,
        12249.9,
        11857.1,
        12260.7,
        11509.5,
        11317.3,
        11070.0,
        11075.5,
        13034.9,
        12977.9,
        12649.7,
        12631.0,
        12360.0,
        12806.5,
        12067.7,
        12008.0,
        12135.8,
        12872.4,
        12459.3,
        12678.3,
        12597.5,
        12387.9,
        12608.7,
        12811.3,
        12271.5,
        12416.2,
        12015.3,
        12323.3,
        12575.2,
        12729.0,
        12531.9,
        12869.2,
        14024.8,
        13377.2,
        13204.7,
        13332.8,
        13694.4,
        14465.5,
        14702.3,
        15080.2,
        16006.7,
        15561.9,
        14818.2,
        15161.4,
        15650.9,
        15318.9,
        15413.3,
        16648.2,
        17567.8,
        16561.2,
        15892.0,
        15943.4,
        16993.0,
        16078.6,
        16368.9,
        17217.5,
        17754.9,
        17504.9,
        18232.5,
        18991.4,
        18106.7,
        17906.3,
        18397.1,
        17276.6,
        17849.6,
        18196.9,
        18151.2,
        18874.0,
        19119.9,
        19305.1,
        20171.8,
        18935.5,
        18429.0,
        18985.6,
        18666.8,
        18966.0,
        18130.1,
        19005.1,
        18635.8,
        19102.0,
        20806.4,
        21233.2,
        22750.3,
        23090.1,
        25096.1,
        24669.7,
        25936.8,
        28925.3,
        30233.9,
        28245.5,
        29449.2,
        29014.6,
        27520.6,
        27186.9,
        28928.2,
        27972.3,
        28727.4,
        29407.5,
        28763.0,
        27885.6,
        26762.8,
        26493.2,
        26874.6,
        27468.0,
        29606.7,
        31045.9,
        31046.2,
        32862.3,
        36353.0,
        38874.6,
        37452.0,
        35288.6,
        37604.5,
        40024.0,
        39083.9,
        36597.9,
        41540.5,
        36135.6,
        40794.2,
        42374.2,
        44945.2,
        48685.3,
        46498.6,
        44193.4,
        45960.7,
        44767.2,
        45025.1,
        46652.3,
        47900.6,
        48843.6,
        54690.0,
        50606.8,
        49794.3,
        51095.9,
        50080.4,
        52311.5,
        55985.7,
        57777.6,
        54247.4,
        58611.8,
        58730.0,
        59829.4,
        63481.9,
        62846.9,
        60922.6,
        63868.9,
        64172.2,
        67892.1,
        69211.6,
        67299.6,
        71963.4,
        83511.7,
        79339.5,
        83852.8,
        91149.9,
        81303.8,
        86232.1,
        86747.7,
        84696.1,
        87020.9,
        87493.4,
        89252.2,
        90207.5,
        91697.8,
        93675.1,
        92473.6,
        93885.8,
        90814.4,
        88548.0,
        86422.3,
        86864.9,
        79142.4,
        78768.3,
        70834.6,
        79928.2,
        92151.1,
        83045.5,
        81366.4,
        78300.0,
        74504.3,
        78381.4,
        82216.5,
        77146.5,
        77715.9,
        73892.0,
        79090.7,
        77786.5,
        78019.3,
        75131.0,
        71484.9,
        73395.5,
        76125.7,
        78053.6,
        75031.3,
        74283.9,
        74963.6,
        76090.2,
        74569.3,
        70427.4,
        75449.1,
        73123.0,
        74646.8,
        70780.9,
        70125.6,
        75466.2,
        84498.0,
        81917.2,
        85277.1,
        81556.1,
        89144.0,
        89893.9,
        87680.5,
        88052.0,
        84952.4,
        80639.7,
        77772.2,
        82282.4,
        83772.1,
        80834.3,
        81470.7,
        81695.2,
        80295.9,
        81314.9,
        83855.2,
        83812.1,
        82269.2,
        82547.3,
        82401.3,
        85550.2,
        85853.0,
        86343.7,
        87643.0,
        88088.3,
        85674.6,
        83740.4,
        85285.3,
        86063.7,
        89839.5,
        84857.1,
        89293.4,
        94109.5,
        93826.2,
        89738.8,
        89188.8,
        90288.5,
        97259.7,
        98194.0,
        109139.2,
        105261.4,
        107169.8,
        104747.5,
        108120.0,
        113044.6,
        116178.9,
        121719.1,
        127868.0,
        130717.8,
        133498.2,
        146999.1,
        144075.6,
        139215.5,
        139459.2,
        130527.8
    ]
}
