{
    "Name": "NASDAQ 100 Total Returns Index",
    "StartYear": 1999,
    "StartMonth": 4,
    "Currency": "USD",
    "NetAssetValueArray":
    [
        2136.7,
        2090.2,
        2297.4,
        2271.7,
        2397.8,
        2408.9,
        2638.6,
        2968.1,
        3710,
        3572.2,
        4269.7,
        4400.7,
        3775.8,
        3326.5,
        3766.5,
        3612.1,
        4080.8,
        3573.5,
        3285,
        2508.7,
        2343.8,
        2595.5,
        1910.3,
        1574.9,
        1857.2,
        1802,
        1169.9,
        1366.7,
        1598.4,
        1579.4,
        1552.5,
        1361.5,
        1455.2,
        1279.3,
        1210.5,
        1053.3,
        964,
        944.3,
        834.2,
        991.7,
        1118.6,
        986.7,
        985.5,
        1012.9,
        1021.9,
        1109.6,
        1202,
        1205.9,
        1281.5,
        1346.3,
        1308.7,
        1422.7,
        1430.9,
        1475,
        1500.4,
        1478.1,
        1446,
        1408.9,
        1474.6,
        1525.4,
        1408.7,
        1377.7,
        1422.1,
        1496.7,
        1582.8,
        1633.5,
        1531.4,
        1524,
        1495.4,
        1433.3,
        1557.4,
        1507.9,
        1620.8,
        1598.3,
        1618.5,
        1596,
        1691.4,
        1664.5,
        1731,
        1691.6,
        1725.4,
        1722.6,
        1601.2,
        1597,
        1530.5,
        1603.3,
        1678.9,
        1758.6,
        1819.5,
        1785.7,
        1821.8,
        1792.2,
        1803.4,
        1900.7,
        1963.8,
        1969.9,
        1968.1,
        2027.7,
        2132.2,
        2283.1,
        2132.4,
        2129.2,
        1880.7,
        1784.2,
        1822.1,
        1961.1,
        2080.4,
        1880.5,
        1893.1,
        1918.7,
        1634.1,
        1368,
        1216.9,
        1244,
        1212,
        1148.9,
        1272.7,
        1435,
        1479.3,
        1522.6,
        1653,
        1677.3,
        1774.5,
        1721.4,
        1827,
        1923.4,
        1800.4,
        1883,
        2028,
        2072.6,
        1921.2,
        1804.7,
        1934.7,
        1836.6,
        2076.6,
        2208.6,
        2205.2,
        2310.8,
        2378,
        2452.4,
        2440.7,
        2509.3,
        2480,
        2431.7,
        2472.2,
        2348.9,
        2242.6,
        2475.4,
        2412.8,
        2395.4,
        2596.2,
        2764.3,
        2904.3,
        2872.4,
        2667.4,
        2765.2,
        2794.7,
        2938.4,
        2968.7,
        2809.9,
        2850.1,
        2835,
        2910.5,
        2924.8,
        3012.2,
        3087.4,
        3195.5,
        3121.1,
        3317.2,
        3307.8,
        3464.8,
        3638.5,
        3767.2,
        3881.6,
        3807.4,
        4004.1,
        3897.7,
        3884.7,
        4061.5,
        4186.9,
        4235.8,
        4451.8,
        4418.4,
        4538.3,
        4744.3,
        4634.7,
        4540.8,
        4869.8,
        4756.4,
        4846.1,
        4958.3,
        4839.4,
        5053.3,
        4716.6,
        4615.6,
        5134.5,
        5163,
        5086.6,
        4741.1,
        4665.4,
        4981.9,
        4826.4,
        5041.3,
        4925.2,
        5276.4,
        5333.3,
        5452.5,
        5371.5,
        5394.7,
        5456.6,
        5742.9,
        5993.8,
        6116.5,
        6285.2,
        6529,
        6372.5,
        6638.3,
        6773.3,
        6765.5,
        7073.4,
        7219.4,
        7256.9,
        7888.2,
        7792.3,
        7485.7,
        7516.4,
        7943.1,
        8029.9,
        8251.5,
        8746.9,
        8721.5,
        7969.8,
        7962.6,
        7259.6,
        7924.4,
        8157,
        8485.7,
        8952.1,
        8214,
        8846,
        9055,
        8886.5,
        8960,
        9351.6,
        9735.2,
        10124,
        10428.2,
        9825.9,
        9081.8,
        10465.2,
        11125.6,
        11604.9,
        12710.7,
        14129.2,
        13328,
        12906.7,
        14339.94
    ]
}
