{
    "Name": "CRISIL 10-year GILT Index",
    "StartYear": 2001,
    "StartMonth": 9,
    "Currency": "INR",
    "NetAssetValueArray":
    [
        1008.78,
        1034.86,
        1101.4,
        1103.02,
        1134.35,
        1137.94,
        1169.67,
        1175.68,
        1167.82,
        1193.69,
        1212.83,
        1228.62,
        1236.26,
        1263.4,
        1319.33,
        1339.85,
        1324.38,
        1368.1,
        1357.4,
        1385.05,
        1400.12,
        1413.33,
        1430.41,
        1471.91,
        1488.89,
        1503.13,
        1503.2,
        1512.85,
        1509.98,
        1513.21,
        1531.8,
        1541.82,
        1530.74,
        1477.62,
        1452.92,
        1466.2,
        1458.53,
        1403.45,
        1385.34,
        1440.45,
        1443.32,
        1466.88,
        1461.79,
        1401.21,
        1446.18,
        1463.79,
        1461.24,
        1460.06,
        1466.46,
        1476.99,
        1487.23,
        1492.45,
        1484.79,
        1482.14,
        1489.81,
        1516.24,
        1498.33,
        1459.43,
        1458.99,
        1502.84,
        1536.97,
        1547.82,
        1578.03,
        1568.18,
        1567.27,
        1549.69,
        1557.96,
        1551.44,
        1571.05,
        1575.01,
        1612.7,
        1613.98,
        1624.31,
        1641.38,
        1644.64,
        1667.74,
        1708.65,
        1713.69,
        1683.29,
        1699.04,
        1689.53,
        1636.05,
        1583.4,
        1657.51,
        1679.11,
        1813.95,
        1876.32,
        2127.73,
        2012.11,
        2007.66,
        1877.07,
        1996.27,
        1941.18,
        1909.39,
        1902.28,
        1855.03,
        1898.46,
        1896.41,
        1940.16,
        1943.44,
        1955.87,
        1930.24,
        1944.57,
        1932.01,
        1960.89,
        1974.89,
        1954.17,
        1950.05,
        1973.45,
        1952.78,
        1970.9,
        2003.8,
        1987.85,
        2017.75,
        2034.3,
        2008.93,
        1985.4,
        2010.16,
        2007.09,
        2038.91,
        2036.56,
        1995.11,
        2004.55,
        2042.15,
        2095.39,
        2118.74,
        2083.83,
        2085.76,
        2139.33,
        2153.43,
        2158.12,
        2173.27,
        2200.57,
        2206.03,
        2226.24,
        2260,
        2295.19,
        2315.96,
        2319.29,
        2366.39,
        2423.87,
        2414.32,
        2311.44,
        2262.53,
        2253.41,
        2290.2,
        2245.96,
        2244.68,
        2268.17,
        2271.18,
        2295.99,
        2309.02,
        2351.73,
        2353.76,
        2374.26,
        2383.57,
        2407.71,
        2461.02,
        2508.11,
        2562.14,
        2605.39,
        2616.27,
        2630.54,
        2627,
        2651.17,
        2630.66,
        2657.3,
        2678.08,
        2738.93,
        2737.95,
        2728.9,
        2751.44,
        2765.08,
        2791.6,
        2840.29,
        2862.08,
        2872.67,
        2894.62,
        2967.96,
        2995.9,
        3043.35,
        3068.53,
        3205.93,
        3163.38,
        3202.98,
        3121.72,
        3177.5,
        3137.77,
        3190.85,
        3233.13,
        3260.86,
        3264.57,
        3251.32,
        3225.57,
        3201.55,
        3161.92,
        3125.12,
        3076.35,
        3165.46,
        3106.85,
        3114.71,
        3119.01,
        3166.36,
        3149.16,
        3154.8,
        3210.51,
        3282.25,
        3352.46,
        3348.74,
        3346.28,
        3381.23,
        3386.17,
        3494.55,
        3550.39,
        3693.25,
        3664.75,
        3650.46,
        3683.55,
        3707.56,
        3703.24,
        3711.86,
        3791.88,
        3876.7,
        3901.36,
        3950.24,
        3947.16,
        3979.14,
        3906.97,
        3952.46,
        4011.04,
        4021.34
    ]
}
